{
  "schema_version": "ghostark.research.guardrail_observation.v1",
  "observation_id": "gobs_fixture_unbound_001",
  "observed_at": "2026-07-09T12:00:00.000Z",
  "scope": {
    "tenant_id_hash": "hmac-sha256:aaaaaaaaaaaaaaaaaaaaaaaaaaaaaaaaaaaaaaaaaaaaaaaaaaaaaaaaaaaaaaaa",
    "request_id_hash": "hmac-sha256:bbbbbbbbbbbbbbbbbbbbbbbbbbbbbbbbbbbbbbbbbbbbbbbbbbbbbbbbbbbbbbbb"
  },
  "guardrail": {
    "guardrail_id": "toxicity-filter",
    "guardrail_version": "fixture-v1",
    "evaluation_stage": "post_model"
  },
  "result": {
    "outcome": "flag",
    "action": "queue_review",
    "scores": [
      {
        "name": "toxicity_score",
        "value": 0.91,
        "lower_bound": 0,
        "upper_bound": 1
      }
    ],
    "findings": [
      {
        "category": "toxicity",
        "severity": "high"
      }
    ]
  },
  "content_evidence": {
    "input_digest": "sha256:cccccccccccccccccccccccccccccccccccccccccccccccccccccccccccccccc",
    "output_digest": "sha256:dddddddddddddddddddddddddddddddddddddddddddddddddddddddddddddddd",
    "raw_content_included": false
  },
  "privacy": {
    "classification": "pseudonymous",
    "redaction_applied": true,
    "redaction_policy_id": "guardrail-observation-export-v1",
    "redaction_policy_digest": "sha256:eeeeeeeeeeeeeeeeeeeeeeeeeeeeeeeeeeeeeeeeeeeeeeeeeeeeeeeeeeeeeeee",
    "suppressed_fields": ["prompt", "completion", "user_identifier"]
  },
  "receipt_binding": {
    "status": "unbound",
    "receipt_id": null,
    "receipt_digest": null
  },
  "telemetry": {
    "trace_id": "11111111111111111111111111111111",
    "span_id": "2222222222222222"
  },
  "non_claims": [
    "This is a schema fixture; it does not show that an application emitted this observation.",
    "The recorded guardrail result does not establish semantic correctness or a correct human disposition."
  ]
}
